{
  "schemaVersion": "3.0.0",
  "id": "exam-sample-2022-dec-b-study",
  "revision": 1,
  "subject": "B",
  "title": "2022年12月公表 サンプル問題 学習",
  "mode": "study",
  "questionCount": 20,
  "questionOrder": "set",
  "choiceOrder": "fixed",
  "duplicatePolicy": "lineage_unique",
  "shortagePolicy": "block"
}
