{
  "schemaVersion": "3.0.0",
  "id": "exam-annual-2025-a-practice",
  "revision": 1,
  "subject": "A",
  "title": "2025年度 公開問題 時間付き練習",
  "mode": "practice",
  "questionCount": 20,
  "questionOrder": "set",
  "choiceOrder": "fixed",
  "duplicatePolicy": "lineage_unique",
  "shortagePolicy": "block",
  "timeLimitSeconds": 1800,
  "practiceScope": "public_subset"
}
