{
  "schemaVersion": "3.0.0",
  "id": "exam-2017-spring-pm-mix-practice",
  "revision": 1,
  "title": "2017年度 春期・旧午後 ランダムミックス 時間付き練習",
  "subject": "B",
  "mode": "practice",
  "questionCount": 7,
  "timeLimitSeconds": 9000,
  "practiceScope": "public_subset",
  "questionOrder": "set",
  "choiceOrder": "fixed",
  "duplicatePolicy": "instance_unique",
  "shortagePolicy": "block"
}
