{
  "schemaVersion": "3.0.0",
  "id": "exam-sample-2022-apr-b-practice",
  "revision": 1,
  "subject": "B",
  "title": "2022年4月公表 サンプル問題 時間付き練習",
  "mode": "practice",
  "questionCount": 6,
  "questionOrder": "set",
  "choiceOrder": "fixed",
  "duplicatePolicy": "lineage_unique",
  "shortagePolicy": "block",
  "timeLimitSeconds": 1800,
  "practiceScope": "public_subset"
}
